{
  "id": "9b4d6e83-2a5c-4f17-8d60-3e7a1c9b5f0c",
  "kind": "endpoint",
  "name": "ImportReview",
  "formatVersion": 1,
  "entity": "reviews/Review",
  "process": "reviews/Close",
  "input": [{ "name": "title", "type": "text", "required": true, "maxLength": 100 }],
  "values": { "title": "title" }
}
